{
  "symbol": "SPX500",
  "timezone": "America/New_York",
  "bar_minutes": 1,
  "data_notes": "From 1m sample ~27d Jun–Jul 2026",
  "peak_hours_et": ["14:30", "15:00", "15:30"],
  "avoid": ["16:00 continuation"],
  "windows": [
    {
      "id": "spx_1430_fade",
      "label": "Peak volume fade",
      "start_et": "14:30",
      "entry_et": "14:40",
      "exit_et": "15:30",
      "side": "fade",
      "min_impulse_points": 5,
      "tp_points": 5,
      "tp_mode": "pct_impulse",
      "tp_pct_impulse": 0.5,
      "sl_points": 3,
      "sl_mode": "beyond_extreme",
      "weekdays": ["Mon", "Tue", "Wed", "Thu", "Fri"],
      "confidence": "medium",
      "stats": { "median_retrace_30m_pct": 0.45 }
    }
  ]
}
